{
  "outline": [
    {
      "first_block_id": "j07-p001-b002",
      "id": "senate",
      "page": 1,
      "timing": null,
      "title": "SENATE"
    },
    {
      "first_block_id": "j07-p001-b004",
      "id": "journal",
      "page": 1,
      "timing": null,
      "title": "JOURNAL"
    },
    {
      "first_block_id": "j07-p001-b006",
      "id": "impeachment-trial-no-7",
      "page": 1,
      "timing": null,
      "title": "IMPEACHMENT TRIAL NO. 7"
    },
    {
      "first_block_id": "j07-p001-b007",
      "id": "wednesday-15-july-2026",
      "page": 1,
      "timing": null,
      "title": "WEDNESDAY, 15 JULY 2026"
    },
    {
      "first_block_id": "j07-p002-b001",
      "id": "prepared-by-the-legislative-journal-service",
      "page": 2,
      "timing": null,
      "title": "PREPARED BY THE LEGISLATIVE JOURNAL SERVICE"
    },
    {
      "first_block_id": "j07-p002-b002",
      "id": "senate-of-the-philippines",
      "page": 2,
      "timing": null,
      "title": "SENATE OF THE PHILIPPINES"
    },
    {
      "first_block_id": "j07-p003-b001",
      "id": "impeachment-trial-no-7-2",
      "page": 3,
      "timing": null,
      "title": "IMPEACHMENT TRIAL NO. 7"
    },
    {
      "first_block_id": "j07-p003-b003",
      "id": "call-to-order",
      "page": 3,
      "timing": null,
      "title": "CALL TO ORDER"
    },
    {
      "first_block_id": "j07-p003-b005",
      "id": "proclamation-of-the-sergeant-at-arms",
      "page": 3,
      "timing": null,
      "title": "PROCLAMATION OF THE SERGEANT-AT-ARMS"
    },
    {
      "first_block_id": "j07-p003-b007",
      "id": "prayer",
      "page": 3,
      "timing": {
        "confidence": 0.88,
        "end": 311.28,
        "precision": "approximate_dialogue_turn",
        "review_state": "auto_accepted",
        "start": 279.32,
        "time_domain": "session_video"
      },
      "title": "PRAYER"
    },
    {
      "first_block_id": "j07-p004-b002",
      "id": "roll-call",
      "page": 4,
      "timing": null,
      "title": "ROLL CALL"
    },
    {
      "first_block_id": "j07-p004-b010",
      "id": "manifestation-of-senator-judge-padilla",
      "page": 4,
      "timing": null,
      "title": "MANIFESTATION OF SENATOR-JUDGE PADILLA"
    },
    {
      "first_block_id": "j07-p004-b012",
      "id": "manifestation-of-senator-judge-cayetano-a",
      "page": 4,
      "timing": null,
      "title": "MANIFESTATION OF SENATOR-JUDGE CAYETANO (A)"
    },
    {
      "first_block_id": "j07-p005-b006",
      "id": "manifestation-of-senator-judge-cayetano-p",
      "page": 5,
      "timing": null,
      "title": "MANIFESTATION OF SENATOR-JUDGE CAYETANO (P)"
    },
    {
      "first_block_id": "j07-p005-b011",
      "id": "suspension-of-trial",
      "page": 5,
      "timing": null,
      "title": "SUSPENSION OF TRIAL"
    },
    {
      "first_block_id": "j07-p006-b002",
      "id": "resumption-of-trial",
      "page": 6,
      "timing": null,
      "title": "RESUMPTION OF TRIAL"
    },
    {
      "first_block_id": "j07-p006-b004",
      "id": "ruling-of-the-presiding-officer",
      "page": 6,
      "timing": null,
      "title": "RULING OF THE PRESIDING OFFICER"
    },
    {
      "first_block_id": "j07-p006-b006",
      "id": "manifestation-of-senator-judge-pangilinan",
      "page": 6,
      "timing": null,
      "title": "MANIFESTATION OF SENATOR-JUDGE PANGILINAN"
    },
    {
      "first_block_id": "j07-p006-b009",
      "id": "manifestation-of-senator-judge-cayetano-p-2",
      "page": 6,
      "timing": null,
      "title": "MANIFESTATION OF SENATOR-JUDGE CAYETANO (P)"
    },
    {
      "first_block_id": "j07-p006-b012",
      "id": "manifestation-of-senator-judge-cayetano-a-2",
      "page": 6,
      "timing": null,
      "title": "MANIFESTATION OF SENATOR-JUDGE CAYETANO (A)"
    },
    {
      "first_block_id": "j07-p006-b015",
      "id": "approval-of-the-journal",
      "page": 6,
      "timing": null,
      "title": "APPROVAL OF THE JOURNAL"
    },
    {
      "first_block_id": "j07-p006-b017",
      "id": "calling-of-the-case",
      "page": 6,
      "timing": null,
      "title": "CALLING OF THE CASE"
    },
    {
      "first_block_id": "j07-p007-b002",
      "id": "appearances",
      "page": 7,
      "timing": null,
      "title": "APPEARANCES"
    },
    {
      "first_block_id": "j07-p007-b006",
      "id": "manifestation-of-senator-judge-cayetano-a-3",
      "page": 7,
      "timing": null,
      "title": "MANIFESTATION OF SENATOR-JUDGE CAYETANO (A)"
    },
    {
      "first_block_id": "j07-p007-b008",
      "id": "manifestations-of-the-presiding-officer",
      "page": 7,
      "timing": null,
      "title": "MANIFESTATIONS OF THE PRESIDING OFFICER"
    },
    {
      "first_block_id": "j07-p007-b013",
      "id": "oral-argument-of-the-prosecution",
      "page": 7,
      "timing": null,
      "title": "ORAL ARGUMENT OF THE PROSECUTION"
    },
    {
      "first_block_id": "j07-p010-b002",
      "id": "request-of-prosecutor-diokno",
      "page": 10,
      "timing": null,
      "title": "REQUEST OF PROSECUTOR DIOKNO"
    },
    {
      "first_block_id": "j07-p010-b004",
      "id": "oral-argument-of-the-counsel-for-the-respondent",
      "page": 10,
      "timing": null,
      "title": "ORAL ARGUMENT OF THE COUNSEL FOR THE RESPONDENT"
    },
    {
      "first_block_id": "j07-p012-b005",
      "id": "remarks-of-the-presiding-officer",
      "page": 12,
      "timing": null,
      "title": "REMARKS OF THE PRESIDING OFFICER"
    },
    {
      "first_block_id": "j07-p012-b008",
      "id": "rebuttal-of-the-prosecution",
      "page": 12,
      "timing": null,
      "title": "REBUTTAL OF THE PROSECUTION"
    },
    {
      "first_block_id": "j07-p013-b007",
      "id": "remarks-of-the-presiding-officer-2",
      "page": 13,
      "timing": {
        "confidence": 0.332,
        "end": 3336.08,
        "precision": "approximate_dialogue_turn",
        "review_state": "needs_review",
        "start": 3326.08,
        "time_domain": "session_video"
      },
      "title": "REMARKS OF THE PRESIDING OFFICER"
    },
    {
      "first_block_id": "j07-p014-b008",
      "id": "remarks-of-the-presiding-officer-3",
      "page": 14,
      "timing": null,
      "title": "REMARKS OF THE PRESIDING OFFICER"
    },
    {
      "first_block_id": "j07-p014-b010",
      "id": "manifestation-of-senator-judge-cayetano-a-4",
      "page": 14,
      "timing": null,
      "title": "MANIFESTATION OF SENATOR-JUDGE CAYETANO (A)"
    },
    {
      "first_block_id": "j07-p015-b004",
      "id": "manifestation-of-senator-judge-pangilinan-2",
      "page": 15,
      "timing": null,
      "title": "MANIFESTATION OF SENATOR-JUDGE PANGILINAN"
    },
    {
      "first_block_id": "j07-p015-b007",
      "id": "suspension-of-trial-2",
      "page": 15,
      "timing": null,
      "title": "SUSPENSION OF TRIAL"
    },
    {
      "first_block_id": "j07-p015-b010",
      "id": "resumption-of-trial-2",
      "page": 15,
      "timing": null,
      "title": "RESUMPTION OF TRIAL"
    },
    {
      "first_block_id": "j07-p015-b012",
      "id": "ruling-of-the-presiding-officer-2",
      "page": 15,
      "timing": null,
      "title": "RULING OF THE PRESIDING OFFICER"
    },
    {
      "first_block_id": "j07-p015-b014",
      "id": "manifestation-of-representative-luistro",
      "page": 15,
      "timing": null,
      "title": "MANIFESTATION OF REPRESENTATIVE LUISTRO"
    },
    {
      "first_block_id": "j07-p016-b008",
      "id": "request-of-representative-luistro",
      "page": 16,
      "timing": null,
      "title": "REQUEST OF REPRESENTATIVE LUISTRO"
    },
    {
      "first_block_id": "j07-p016-b010",
      "id": "ruling-of-the-presiding-officer-3",
      "page": 16,
      "timing": null,
      "title": "RULING OF THE PRESIDING OFFICER"
    },
    {
      "first_block_id": "j07-p016-b012",
      "id": "inquiry-of-senator-judge-aquino",
      "page": 16,
      "timing": null,
      "title": "INQUIRY OF SENATOR-JUDGE AQUINO"
    },
    {
      "first_block_id": "j07-p017-b004",
      "id": "manifestation-of-attorney-sison",
      "page": 17,
      "timing": null,
      "title": "MANIFESTATION OF ATTORNEY SISON"
    },
    {
      "first_block_id": "j07-p017-b011",
      "id": "manifestation-of-representative-luistro-2",
      "page": 17,
      "timing": null,
      "title": "MANIFESTATION OF REPRESENTATIVE LUISTRO"
    },
    {
      "first_block_id": "j07-p017-b013",
      "id": "manifestation-of-senator-judge-cayetano-a-5",
      "page": 17,
      "timing": null,
      "title": "MANIFESTATION OF SENATOR-JUDGE CAYETANO (A)"
    },
    {
      "first_block_id": "j07-p018-b005",
      "id": "manifestation-of-senator-judge-pangilinan-3",
      "page": 18,
      "timing": null,
      "title": "MANIFESTATION OF SENATOR-JUDGE PANGILINAN"
    },
    {
      "first_block_id": "j07-p018-b008",
      "id": "manifestation-of-attorney-sison-2",
      "page": 18,
      "timing": null,
      "title": "MANIFESTATION OF ATTORNEY SISON"
    },
    {
      "first_block_id": "j07-p018-b010",
      "id": "manifestation-of-senator-judge-cayetano-p-3",
      "page": 18,
      "timing": null,
      "title": "MANIFESTATION OF SENATOR-JUDGE CAYETANO (P)"
    },
    {
      "first_block_id": "j07-p018-b013",
      "id": "manifestation-of-representative-luistro-3",
      "page": 18,
      "timing": null,
      "title": "MANIFESTATION OF REPRESENTATIVE LUISTRO"
    },
    {
      "first_block_id": "j07-p019-b001",
      "id": "wednesday-july-15-2026-17-adjournment-of-the-impeachment-trial",
      "page": 19,
      "timing": null,
      "title": "WEDNESDAY, JULY 15,2026 17 ADJOURNMENT OF THE IMPEACHMENT TRIAL"
    },
    {
      "first_block_id": "j07-p019-b005",
      "id": "nato-n-tug-jr",
      "page": 19,
      "timing": null,
      "title": "'NATO N. TUG JR."
    }
  ],
  "pages": [
    {
      "blocks": [
        {
          "id": "j07-p001-b001",